{
  "schema_version": "1.0",
  "task_id": "AB-01-DRYRUN-ENV",
  "report_sha256": "0000000000000000000000000000000000000000000000000000000000000000",
  "review_status": "awaiting-review",
  "reviewer": "",
  "tests_decision": "insufficient",
  "risk_decision": "mitigate",
  "acceptance_decision": "pending",
  "findings": [],
  "required_actions": [],
  "reviewed_at": ""
}
