{
    "schema_version":  "1.0",
    "task_id":  "AB09K-CODEX-PROBE",
    "report_sha256":  "1e082fe5cfa46e15915b5031226a3ca0e151c6bcb42465a55162946c1db257b1",
    "review_status":  "awaiting-review",
    "reviewer":  "",
    "tests_decision":  "insufficient",
    "risk_decision":  "mitigate",
    "acceptance_decision":  "pending",
    "findings":  [

                 ],
    "required_actions":  [

                         ],
    "reviewed_at":  ""
}